,,,,,,,,,,,,,,,,,,,,,,,,,,,,,,,,,Stakeholder engagement scales,,,,,,,,,,,,,,,,,,,,,,,,
2022,Hao L. Wang P. Yu J. & Ruan H. (2022). An integrative analytical framework of water-energy-food security for sustainable development at the country scale: A case study of five Central Asian countries. Journal of Hydrology 607 127530.,N,N,0,0,0,0,0,0,0,Y,0,0,0,0,1,0,0,0,0,0,N,0,0,0,0,0,0,0,0,0,0,0,0,0,0,0,0,0,0,0,0,0,0,0,0,0,0,0,0,0,0,0,0,1,0,0
2022,Hasanzadeh-Saray M. H. Baubekova A. Gohari A. Eslamian S. S. Klove B. & Haghighi A. T. (2022). Optimization of Water-Energy-Food Nexus considering CO2 emissions from cropland: A case study in northwest Iran. Applied Energy 307 118236.,N,N,0,0,0,0,0,0,0,Y,0,1,0,0,0,0,0,0,1,0,N,0,0,0,0,0,0,0,0,0,0,0,0,0,0,0,0,0,0,0,0,0,0,0,0,0,0,0,0,0,0,1,0,0,0,0
2022,He L. Xu Z. Wang S. Bao J. Fan Y. & Daccache A. (2022). Optimal crop planting pattern can be harmful to reach carbon neutrality: Evidence from food-energy-water-carbon nexus perspective. Applied Energy 308 118364.,N,N,0,0,0,0,0,0,0,Y,0,1,0,0,1,0,0,0,1,0,N,0,0,0,0,0,0,0,0,0,0,0,0,0,0,0,0,0,0,0,0,0,0,0,0,0,0,0,0,0,0,1,0,0,0,0
2021,Her C. Sambor D. J. Whitney E. & Wies R. (2021). Novel wind resource assessment and demand flexibility analysis for community resilience: A remote microgrid case study. Renewable Energy 179 1472-1486.,N,N,0,0,0,0,0,0,0,Y,0,1,0,0,1,0,0,0,0,0,N,0,0,0,0,0,0,0,0,0,0,0,0,0,0,0,0,0,0,0,0,0,0,0,0,0,0,0,0,0,1,0,0,0,0,0
2022,Hernández-Pérez L. G. Sánchez-Zarco X. G. & Ponce-Ortega J. M. (2022). Multi-objective optimization method based on deterministic and metaheuristic approaches in water–energy–food nexus under uncertainty. International Journal of Environmental Research 16(3) 33.,N,N,0,0,0,0,0,0,0,Y,0,1,0,0,0,0,0,0,0,0,N,0,0,0,0,0,0,0,0,0,0,0,0,0,0,0,0,0,0,0,0,0,0,0,0,0,0,0,0,0,1,0,0,0,0,0
2021,Holmatov B. Schyns J. F. Krol M. S. Gerbens-Leenes P. W. & Hoekstra A. Y. (2021). Can crop residues provide fuel for future transport? Limited global residue bioethanol potentials and large associated land water and carbon footprints. Renewable and Sustainable Energy Reviews 149 111417.,N,N,0,0,0,0,0,0,0,Y,0,1,0,0,0,1,0,0,0,0,N,0,0,0,0,0,0,0,0,0,0,0,0,0,0,0,0,0,0,0,0,0,0,0,0,0,0,0,0,0,0,0,0,0,1,0
2018,Hoolohan C. et al. Stepping‐up innovations in the water–energy–food nexus: A case study of anaerobic digestion in the UK. Geogr J 185 391–405 (2019).,N,N,0,0,0,0,0,0,0,N,0,0,0,0,1,1,0,0,0,0,Y,0,1,0,0,1,0,0,0,1,0,0,1,0,0,0,0,1,0,0,0,0,0,0,0,1,0,0,0,0,0,0,1,0,0,0
2019,Hoolohan C. McLachlan C. & Larkin A. ‘Aha’ moments in the water-energy-food nexus: A new morphological scenario method to accelerate sustainable transformation. Technological Forecasting and Social Change 148 119712 (2019).,N,N,0,0,0,0,0,0,0,Y,0,0,0,0,1,0,0,0,0,0,Y,0,0,0,1,1,0,0,0,1,1,0,1,0,0,0,0,1,0,0,0,0,0,0,0,1,0,0,0,0,0,0,1,0,0,0
2017,Howarth C. & Monasterolo I. Opportunities for knowledge co-production across the energy-food-water nexus: Making interdisciplinary approaches work for better climate decision making. Environmental Science & Policy 75 103–110 (2017).,N,N,0,0,0,0,0,0,0,Y,0,0,0,0,0,1,0,1,0,0,Y,0,1,0,1,1,0,0,0,1,0,0,1,0,0,0,0,0,1,0,0,1,0,0,0,0,0,0,0,0,0,0,1,0,0,0
2022,Hua E. Engel B. A. Guan J. Yin J. Wu N. Han X. ... & Wang Y. (2022). Synergy and competition of water in Food-Energy-Water Nexus: Insights for sustainability. Energy Conversion and Management 266 115848.,N,N,0,0,0,0,0,0,0,Y,0,1,0,0,0,0,0,0,1,0,N,0,0,0,0,0,0,0,0,0,0,0,0,0,0,0,0,0,0,0,0,0,0,0,0,0,0,0,0,0,0,1,0,0,0,0
2020,"Hua T. Zhao W. Wang S. Fu B. & Pereira P. (2020). Identifying priority biophysical indicators for promoting food-energy-water nexus within planetary boundaries. Resources, Conservation and Recycling 163 105102.",N,N,0,0,0,0,0,0,0,Y,1,0,0,0,1,1,0,0,0,0,N,0,0,0,0,0,0,0,0,0,0,0,0,0,0,0,0,0,0,0,0,0,0,0,0,0,0,0,0,0,0,0,0,0,1,0
2023,Huan Y. Zhu X. Liang T. Zhou G. Wang L. Zhang L. & Feng Z. (2023). Identifying holistic actions for implementing the sustainable development goals related to livelihood–energy–ecosystem–water nexus in the Asian water tower region. Resources Conservation and Recycling 191 106905.,N,N,0,0,0,0,0,0,0,Y,0,0,0,1,1,1,1,0,0,0,Y,0,0,0,0,0,0,0,0,0,0,0,0,0,0,0,0,0,0,0,0,0,0,0,0,0,0,0,0,0,0,0,0,1,0,0
2022,Huang D. C. Xu L. Y. He Z. Q. & Cao J. (2022). Evolutionary game analysis of water-saving behavior of energy enterprises and food producers from the perspective of water-energy-food nexus. Journal of Water and Climate Change 13(6) 2459-2478.,N,N,0,0,0,0,0,0,0,Y,0,0,0,0,0,0,1,0,0,0,N,0,0,0,0,0,0,0,0,0,0,0,0,0,0,0,0,0,0,0,0,0,0,0,0,0,0,0,0,0,0,0,0,0,0,1
2023,Huang D. Li G. Chang Y. & Sun C. (2023). Water energy and food nexus efficiency in China: A provincial assessment using a three-stage data envelopment analysis model. Energy 263 126007.,N,N,0,0,0,0,0,0,0,Y,0,1,0,0,0,0,0,1,0,0,N,0,0,0,0,0,0,0,0,0,0,0,0,0,0,0,0,0,0,0,0,0,0,0,0,0,0,0,0,0,0,1,0,0,0,0
2020,Huang D. Li G. Sun C. & Liu Q. Exploring interactions in the local water-energy-food nexus (WEF-Nexus) using a simultaneous equations model. Science of The Total Environment 703 135034 (2020).,N,N,0,0,0,0,0,0,0,Y,0,1,0,0,0,0,0,1,0,0,N,0,0,0,0,0,0,0,0,0,0,0,0,0,0,0,0,0,0,0,0,0,0,0,0,0,0,0,0,0,1,0,0,0,0,0
2021,Huang D. Shen Z. Sun C. & Li G. (2021). Shifting from production-based to consumption-based nexus governance: evidence from an input–output analysis of the local water-energy-food nexus. Water Resources Management 35 1673-1688.,N,N,0,0,0,0,0,0,0,Y,0,1,0,0,0,0,0,1,0,0,N,0,0,0,0,0,0,0,0,0,0,0,0,0,0,0,0,0,0,0,0,0,0,0,0,0,0,0,0,0,0,1,0,0,0,0
2022,Huang K. Dai L. Yu L. Fan Y. Huang G. Xiao Y. & Wu Q. (2022). Planning regional-scale water-energy-food nexus system management under uncertainty: An inexact fractional programming method. Journal of Contaminant Hydrology 247 103985.,N,N,0,0,0,0,0,0,0,Y,0,1,0,0,1,0,0,0,0,0,N,0,0,0,0,0,0,0,0,0,0,0,0,0,0,0,0,0,0,0,0,0,0,0,0,0,0,0,0,0,0,1,0,0,0,0
2019,Huckleberry J. K. & Potts M. D. Constraints to implementing the food-energy-water nexus concept: Governance in the Lower Colorado River Basin. Environmental Science & Policy 92 289–298 (2019).,N,N,0,0,0,0,0,0,0,N,0,0,0,0,0,1,0,0,0,0,N,0,0,0,0,0,0,0,0,0,0,0,0,0,0,0,0,0,0,0,0,0,0,0,0,0,0,0,0,0,0,1,0,0,0,0
2019,Hülsmann S. et al. Integrated modelling and management of water resources: the ecosystem perspective on the nexus approach. Current Opinion in Environmental Sustainability 40 14–20 (2019).,N,N,0,0,0,0,0,0,0,Y,0,0,0,1,1,1,1,0,0,0,N,0,0,0,0,0,0,0,0,0,0,0,0,0,0,0,0,0,0,0,0,0,0,0,0,0,0,0,0,0,0,0,0,0,0,1
2021,Huntington H. P. Schmidt J. I. Loring P. A. Whitney E. Aggarwal S. Byrd A. G. ... & Wilber M. (2021). Applying the food–energy–water nexus concept at the local scale. Nature Sustainability 4(8) 672-679.,N,N,0,0,0,0,0,0,0,Y,0,1,0,1,1,1,1,0,0,0,Y,0,1,1,0,1,0,0,0,0,0,0,1,0,0,0,0,1,0,0,0,0,1,0,0,0,0,0,0,0,1,0,0,0,0,0
2020,Hurford A. P. Harou J. J. Bonzanigo L. Ray P. A. Karki P. Bharati L. & Chinnasamy P. (2020). Efficient and robust hydropower system design under uncertainty-A demonstration in Nepal. Renewable and Sustainable Energy Reviews 132 109910.,N,N,0,0,0,0,0,0,0,Y,0,1,0,0,1,0,0,0,0,0,Y,0,1,0,0,0,0,0,0,0,0,0,0,1,0,0,0,0,0,1,0,0,0,0,0,1,0,0,0,0,0,0,1,0,0,0
2017,Hussien W. A. Memon F. A. & Savic D. A. An integrated model to evaluate water-energy-food nexus at a household scale. Environmental Modelling & Software 93 366–380 (2017).,N,N,0,0,0,0,0,0,0,N,0,1,0,0,1,0,0,0,0,0,Y,0,0,0,0,0,0,0,1,0,0,1,0,0,0,1,0,0,0,0,0,1,0,0,0,0,0,0,0,0,1,0,0,0,0,0
2020,Imasiku K. & Ntagwirumugara E. (2020). An impact analysis of population growth on energy‐water‐food‐land nexus for ecological sustainable development in Rwanda. Food and Energy Security 9(1) e185.,N,N,0,0,0,0,0,0,0,Y,0,0,0,0,0,1,0,0,0,0,N,0,0,0,0,0,0,0,0,0,0,0,0,0,0,0,0,0,0,0,0,0,0,0,0,0,0,0,0,0,0,0,1,0,0,0
2020,Jaroenkietkajorn U. & Gheewala S. H. (2020). Interlinkage between water-energy-food for oil palm cultivation in Thailand. Sustainable Production and Consumption 22 205-217.,N,N,0,0,0,0,0,0,0,Y,0,0,0,0,1,0,0,0,0,0,N,0,0,0,0,0,0,0,0,0,0,0,0,0,0,0,0,0,0,0,0,0,0,0,0,0,0,0,0,0,0,1,0,0,0,0
2023,Ji J. Chen J. Ding T. & Gu Y. (2023). Security assessment and obstacle factors diagnosis of water-energy-food nexus based on pressure-state-response framework in Northwest China. Stochastic Environmental Research and Risk Assessment 37(1) 73-88.,N,N,0,0,0,0,0,0,0,N,0,0,0,1,0,0,1,0,0,0,N,0,0,0,0,0,0,0,0,0,0,0,0,0,0,0,0,0,0,0,0,0,0,0,0,0,0,0,0,0,0,1,0,0,0,0
2020,Ji L. Zhang B. Huang G. & Lu Y. (2020). Multi-stage stochastic fuzzy random programming for food-water-energy nexus management under uncertainties. Resources Conservation and Recycling 155 104665.,N,N,0,0,0,0,0,0,0,N,0,1,0,0,0,0,0,1,0,0,N,0,0,0,0,0,0,0,0,0,0,0,0,0,0,0,0,0,0,0,0,0,0,0,0,0,0,0,0,0,0,1,0,0,0,0
2020,Ji L. Zheng Z. Wu T. Xie Y. Liu Z. Huang G. & Niu D. (2020). Synergetic optimization management of crop-biomass coproduction with food-energy-water nexus under uncertainties. Journal of Cleaner Production 258 120645.,N,N,0,0,0,0,0,0,0,Y,0,1,0,0,1,0,0,1,0,0,N,0,0,0,0,0,0,0,0,0,0,0,0,0,0,0,0,0,0,0,0,0,0,0,0,0,0,0,0,0,0,1,0,0,0,0
2022,"Jiang Q. Bhattarai N. Pahlow M. & Xu Z. (2022). Environmental sustainability and footprints of global aquaculture. Resources, Conservation and Recycling 180 106183.",N,N,0,0,0,0,0,0,0,Y,0,1,0,0,1,1,0,0,0,1,N,0,0,0,0,0,0,0,0,0,0,0,0,0,0,0,0,0,0,0,0,0,0,0,0,0,0,0,0,0,0,0,0,0,1,0
2023,Jing P. Hu T. Sheng J. Mahmoud A. Liu Y. Yang D. ... & Wu Y. (2023). Coupling coordination and spatiotemporal dynamic evolution of the water-energy-food-land (WEFL) nexus in the Yangtze River Economic Belt China. Environmental Science and Pollution Research 30(12) 34978-34995.,N,N,0,0,0,0,0,0,0,Y,0,1,0,0,1,0,1,0,0,0,N,0,0,0,0,0,0,0,0,0,0,0,0,0,0,0,0,0,0,0,0,0,0,0,0,0,0,0,0,0,0,1,0,0,0,0
2021,Johnson C. Bell S. Borrion A. & Comber R. (2021). Working with infrastructural communities: A material participation approach to urban retrofit. Science technology & human values 46(2) 320-345.,Y,Y,1,0,0,0,0,0,0,Y,0,0,0,1,0,0,0,0,0,0,Y,0,1,0,0,1,0,0,0,1,0,0,0,0,1,0,0,0,0,0,1,0,0,0,0,0,0,0,1,0,1,0,0,0,0,0
2017,Johnson O. W. & Karlberg L. Co-exploring the Water-Energy-Food Nexus: Facilitating Dialogue through Participatory Scenario Building. Front. Environ. Sci. 5 24 (2017).,Y,Y,1,0,0,0,0,0,0,N,0,0,0,0,0,1,0,0,0,0,Y,0,1,0,1,0,0,0,1,0,0,0,0,0,1,0,0,0,0,0,1,0,0,0,0,0,0,0,1,0,0,0,1,0,0,0
2021,Jones J. L. & White D. D. (2021). A social network analysis of collaborative governance for the food-energy-water nexus in Phoenix AZ USA. Journal of Environmental Studies and Sciences 11(4) 671-681.,N,N,0,0,0,0,0,0,0,Y,0,0,0,0,0,1,1,0,0,0,N,0,0,0,0,0,0,0,0,0,0,0,0,0,0,0,0,0,0,0,0,0,0,0,0,0,0,0,0,0,1,0,0,0,0,0
2022,Jones J. L. & White D. D. (2022). Understanding barriers to collaborative governance for the food-energy-water nexus: The case of Phoenix Arizona. Environmental Science & Policy 127 111-119.,N,N,0,0,0,0,0,0,0,Y,0,0,0,0,0,1,1,0,0,0,Y,1,1,0,0,1,0,0,0,0,0,0,1,0,0,0,0,1,0,0,0,0,0,0,0,0,1,0,0,0,1,0,0,0,0,0
2022,Jones J. L. White D. D. & Thiam D. (2022). Media framing of the Cape Town water crisis: perspectives on the food-energy-water nexus. Regional Environmental Change 22(2) 79.,N,N,0,0,0,0,0,0,0,Y,0,0,0,0,1,1,0,1,0,0,N,0,0,0,0,0,0,0,0,0,0,0,0,0,0,0,0,0,0,0,0,0,0,0,0,0,0,0,0,0,1,0,0,0,0,0
2020,Kamrani K. Roozbahani A. & Shahdany S. M. H. (2020). Using Bayesian networks to evaluate how agricultural water distribution systems handle the water-food-energy nexus. Agricultural Water Management 239 106265.,N,N,0,0,0,0,0,0,0,Y,0,1,0,0,0,0,0,0,0,0,N,0,0,0,0,0,0,0,0,0,0,0,0,0,0,0,0,0,0,0,0,0,0,0,0,0,0,0,0,0,1,0,0,0,0,0
2021,Karamian F. Mirakzadeh A. A. & Azari A. (2021). The water-energy-food nexus in farming: Managerial insights for a more efficient consumption of agricultural inputs. Sustainable Production and Consumption 27 1357-1371.,N,N,0,0,0,0,0,0,0,Y,0,1,0,0,0,0,0,0,1,0,N,0,0,0,0,0,0,0,0,0,0,0,0,0,0,0,0,0,0,0,0,0,0,0,0,0,0,0,0,0,0,1,0,0,0,0
2023,Karamian F. Mirakzadeh A. A. & Azari A. (2023). Application of multi-objective genetic algorithm for optimal combination of resources to achieve sustainable agriculture based on the water-energy-food nexus framework. Science of The Total Environment 860 160419.,N,N,0,0,0,0,0,0,0,Y,0,1,0,0,0,0,0,0,1,0,Y,1,0,0,0,0,0,0,0,0,1,1,0,0,0,1,0,0,0,0,0,1,0,0,0,0,0,0,0,0,0,1,0,0,0,0
2018,Karan E. & Asadi S. Quantitative modeling of interconnections associated with sustainable food energy and water (FEW) systems. Journal of Cleaner Production 200 86–99 (2018).,N,N,0,0,0,0,0,0,0,Y,0,1,0,0,0,0,0,0,0,0,N,0,0,0,0,0,0,0,0,0,0,0,0,0,0,0,0,0,0,0,0,0,0,0,0,0,0,0,0,0,1,0,0,0,0,0
2023,Karan E. P. Asgari S. & Asadi S. (2023). Resilience assessment of centralized and distributed food systems. Food Security 15(1) 59-75.,N,N,0,0,0,0,0,0,0,Y,0,0,0,0,0,0,0,0,0,0,N,0,0,0,0,0,0,0,0,0,0,0,0,0,0,0,0,0,0,0,0,0,0,0,0,0,0,0,0,0,0,1,0,0,0,0
2018,Karan E. Asadi S. Mohtar R. & Baawain M. Towards the optimization of sustainable food-energy-water systems: A stochastic approach. Journal of Cleaner Production 171 662–674 (2018).,N,N,0,0,0,0,0,0,0,Y,0,1,0,0,0,0,0,0,0,0,N,0,0,0,0,0,0,0,0,0,0,0,0,0,0,0,0,0,0,0,0,0,0,0,0,0,0,0,0,0,1,0,0,0,0,0
2022,Karanisa T. Achour Y. Ouammi A. & Sayadi S. (2022). Smart greenhouses as the path towards precision agriculture in the food-energy and water nexus: case study of Qatar. Environment Systems and Decisions 1-26.,N,N,0,0,0,0,0,0,0,Y,0,1,0,0,0,1,0,0,0,0,N,0,0,0,0,0,0,0,0,0,0,0,0,0,0,0,0,0,0,0,0,0,0,0,0,0,0,0,0,0,1,0,1,0,0,0
2020,Karnib A. & Alameh A. (2020). Technology-oriented approach to quantitative assessment of water–energy–food nexus. International Journal of Energy and Water Resources 4 189-197.,N,N,0,0,0,0,0,0,0,Y,0,0,0,0,0,0,0,0,0,0,N,0,0,0,0,0,0,0,0,0,0,0,0,0,0,0,0,0,0,0,0,0,0,0,0,0,0,0,0,0,0,0,1,0,0,0
2022,Kedir Y. Berhanu B. & Alamirew T. (2022). Analysis of water–energy–crop nexus indicators in irrigated sugarcane of Awash Basin Ethiopia. Environmental Systems Research 11(1) 1-19.,N,N,0,0,0,0,0,0,0,Y,0,1,0,0,1,0,0,0,0,0,N,0,0,0,0,0,0,0,0,0,0,0,0,0,0,0,0,0,0,0,0,0,0,0,0,0,0,0,0,0,0,1,0,0,0,0
2023,Kellner E. (2023). Identifying leverage points for shifting Water-Energy-Food nexus cases towards sustainability through the Networks of Action Situations approach combined with systems thinking. Sustainability Science 18(1) 135-152.,N,N,0,0,0,0,0,0,0,Y,0,0,0,0,1,0,0,0,0,0,Y,1,1,0,0,1,0,0,0,1,0,0,0,1,0,0,0,1,0,0,0,0,0,0,0,0,1,0,0,0,0,0,1,0,0,0
2023,Kellner E. & Martin D. A. (2023). Learning from past coevolutionary processes to envision sustainable futures: Extending an action situations approach to the Water-Energy-Food nexus. Earth system governance 15 100168.,Y,Y,0,1,0,0,0,0,1,Y,0,1,0,0,0,1,0,0,0,0,Y,1,1,0,0,1,0,0,0,1,0,0,1,0,0,0,0,1,0,0,0,0,0,0,0,0,0,1,0,0,0,0,1,0,0,0
2015,Keskinen M. Someth P. Salmivaara A. & Kummu M. Water-Energy-Food Nexus in a Transboundary River Basin: The Case of Tonle Sap Lake Mekong River Basin. Water 7 5416–5436 (2015).,N,N,0,0,0,0,0,0,0,N,0,1,0,0,0,1,0,0,0,0,Y,0,1,0,0,0,0,0,0,0,1,0,1,0,0,0,0,0,1,0,0,0,0,0,0,1,0,0,0,0,1,0,0,0,0,0
2021,"Keyhanpour M. J. Jahromi S. H. M. & Ebrahimi H. (2021). System dynamics model of sustainable water resources management using the Nexus Water-Food-Energy approach. Ain Shams Engineering Journal, 12(2) 1267-1281.",N,N,0,0,0,0,0,0,0,N,0,1,0,0,0,0,0,0,0,0,N,0,0,0,0,0,0,0,0,0,0,0,0,0,0,0,0,0,0,0,0,0,0,0,0,0,0,0,0,0,0,1,0,0,0,0
2023,Khattar R. Mansour F. Abou Najm M. Al-Hindi M. Yassine A. Chamas Z. & Geisseler D. (2023). Incorporating Nitrogen in the water-energy-food nexus: an optimization approach. Cleaner and Circular Bioeconomy 100036.,N,N,0,0,0,0,0,0,0,Y,0,1,0,0,1,0,0,0,0,0,N,0,0,0,0,0,0,0,0,0,0,0,0,0,0,0,0,0,0,0,0,0,0,0,0,0,0,0,0,0,0,0,0,0,0,1
2023,Khayatnezhad M. Fataei E. & Imani A. (2023). Integrated modeling of food–water–energy nexus for maximizing water productivity. Water Supply 23(3) 1362-1374.,N,N,0,0,0,0,0,0,0,Y,0,1,0,0,0,0,0,0,0,0,N,0,0,0,0,0,0,0,0,0,0,0,0,0,0,0,0,0,0,0,0,0,0,0,0,0,0,0,0,0,0,1,0,0,0,0
2022,Kiala Z. Jewitt G. Senzanje A. Mutanga O. Dube T. & Mabhaudhi T. (2022). EO-WEF: a Earth Observations for Water Energy and Food nexus geotool for spatial data visualization and generation. In Water-Energy-Food Nexus Narratives and Resource Securities (pp. 33-48). Elsevier.,N,N,0,0,0,0,0,0,0,Y,0,1,0,0,1,0,1,0,1,0,N,0,0,0,0,0,0,0,0,0,0,0,0,0,0,0,0,0,0,0,0,0,0,0,0,0,0,0,0,0,0,0,0,0,0,1
2018,Kimura M. Masuhara N. & Baba K. Making Social Networks Visible: Shared Awareness Among Stakeholders on Groundwater Resources. in The Water-Energy-Food Nexus (eds. Endo A. & Oh T.) 273–286 (Springer Singapore 2018). doi:10.1007/978-981-10-7383-0_19.,N,N,0,0,0,0,0,0,0,N,0,0,0,0,0,1,1,0,0,0,N,0,0,0,0,0,0,0,0,0,0,0,0,0,0,0,0,0,0,0,0,0,0,0,0,0,0,0,0,0,1,0,0,0,0,0
2016,King C. W. & Carbajales-Dale M. Food–energy–water metrics across scales: project to system level. J Environ Stud Sci 6 39–49 (2016).,N,N,0,0,0,0,0,0,0,N,0,1,0,0,1,0,0,0,0,0,N,0,0,0,0,0,0,0,0,0,0,0,0,0,0,0,0,0,0,0,0,0,0,0,0,0,0,0,0,0,0,0,0,0,0,1
2017,Knox J. W. Haro-Monteagudo D. Hess T. M. & Morris J. Identifying Trade-Offs and Reconciling Competing Demands for Water: Integrating Agriculture Into a Robust Decision-Making Framework. Earth’s Future 6 1457–1470 (2018).,Y,Y,0,1,0,0,0,0,0,N,0,0,0,0,1,0,0,0,0,0,Y,1,1,0,1,1,0,0,0,1,0,0,0,1,0,0,0,0,0,1,0,0,0,0,0,0,1,0,0,0,0,1,0,0,0,0
2019,Kulat M. I. Mohtar R. H. & Olivera F. Holistic Water-Energy-Food Nexus for Guiding Water Resources Planning: Matagorda County Texas Case. Front. Environ. Sci. 7 3 (2019).,N,N,0,0,0,0,0,0,0,Y,0,1,0,0,0,0,0,0,1,0,N,0,0,0,0,0,0,0,0,0,0,0,0,0,0,0,0,0,0,0,0,0,0,0,0,0,0,0,0,0,0,1,0,0,0,0
2023,Lahlou F. Z. AlNouss A. Govindan R. Hazrat B. Mackey H. R. & Al-Ansari T. (2023). Water and sludge resource planning for sustainable agriculture: An energy-water-food-waste nexus approach. Sustainable Production and Consumption.,N,N,0,0,0,0,0,0,0,N,0,1,0,0,0,1,0,0,0,0,N,0,0,0,0,0,0,0,0,0,0,0,0,0,0,0,0,0,0,0,0,0,0,0,0,0,0,0,0,0,0,1,0,0,0,0
2020,Lahlou F. Z. Mackey H. R. McKay G. Onwusogh U. & Al-Ansari T. (2020). Water planning framework for alfalfa fields using treated wastewater fertigation in Qatar: An energy-water-food nexus approach. Computers & Chemical Engineering 141 106999.,N,N,0,0,0,0,0,0,0,Y,0,1,0,1,0,0,0,0,0,0,N,0,0,0,0,0,0,0,0,0,0,0,0,0,0,0,0,0,0,0,0,0,0,0,0,0,0,0,0,0,0,0,1,0,0,0
2019,Lant C. et al. The U.S. food–energy–water system: A blueprint to fill the mesoscale gap for science and decision-making. Ambio 48 251–263 (2019).,N,N,0,0,0,0,0,0,0,Y,0,1,0,0,0,1,0,0,0,0,N,0,0,0,0,0,0,0,0,0,0,0,0,0,0,0,0,0,0,0,0,0,0,0,0,0,0,0,0,0,0,0,1,0,0,0
2016,Laspidou C. S. Kofinas D. T. Mellios N. K. & Witmer M. Modelling the Water-Energy-Food-Land Use-Climate Nexus: The Nexus Tree Approach. Proceedings 2 617 (2018).,N,N,0,0,0,0,0,0,0,Y,0,1,0,0,0,0,0,0,1,0,N,0,0,0,0,0,0,0,0,0,0,0,0,0,0,0,0,0,0,0,0,0,0,0,0,0,0,0,0,0,0,0,0,0,0,1
2020,Laspidou C. S. Mellios N. K. Spyropoulou A. E. Kofinas D. T. & Papadopoulou M. P. (2020). Systems thinking on the resource nexus: Modeling and visualisation tools to identify critical interlinkages for resilient and sustainable societies and institutions. Science of the Total Environment 717 137264.,N,N,0,0,0,0,0,0,0,Y,0,1,0,0,0,0,0,0,0,0,N,0,0,0,0,0,0,0,0,0,0,0,0,0,0,0,0,0,0,0,0,0,0,0,0,0,0,0,0,0,0,0,1,0,0,0
2020,Laubscher R. K. & Cowan A. K. (2020). Elaboration of an algae‐to‐energy system and recovery of water and nutrients from municipal sewage. Engineering in Life Sciences 20(7) 305-315.,N,N,0,0,0,0,0,0,0,Y,0,0,0,0,1,0,0,0,0,0,N,0,0,0,0,0,0,0,0,0,0,0,0,0,0,0,0,0,0,0,0,0,0,0,0,0,0,0,0,0,1,0,0,0,0,0
2021,Lazaro L. L. B. Giatti L. L. Bermann C. Giarolla A. & Ometto J. (2021). Policy and governance dynamics in the water-energy-food-land nexus of biofuels: Proposing a qualitative analysis model. Renewable and Sustainable Energy Reviews 149 111384.,N,N,0,0,0,0,0,0,0,N,0,0,0,0,1,1,0,0,0,0,N,0,0,0,0,0,0,0,0,0,0,0,0,0,0,0,0,0,0,0,0,0,0,0,0,0,0,0,0,0,0,0,1,0,0,0
2021,"Lee L. C. Wang Y. & Zuo J. (2021). The nexus of water-energy-food in China's tourism industry. Resources, Conservation and Recycling 164 105157.",N,N,0,0,0,0,0,0,0,Y,0,1,0,0,0,0,1,0,0,0,N,0,0,0,0,0,0,0,0,0,0,0,0,0,0,0,0,0,0,0,0,0,0,0,0,0,0,0,0,0,0,0,1,0,0,0
2020,Lee S. H. Assi A. T. Daher B. Mengoub F. E. & Mohtar R. H. (2020). A Water-Energy-Food Nexus approach for conducting trade-off analysis: Morocco's phosphate industry in the Khouribga region. Hydrology and Earth System Sciences 24(10) 4727-4741.,N,N,0,0,0,0,0,0,0,Y,0,1,0,0,1,1,1,1,1,0,Y,0,1,0,0,1,0,0,0,0,0,0,0,1,0,0,0,0,0,1,0,0,0,0,0,0,1,0,0,0,0,1,0,0,0,0
2023,Lee S. H. Assi A. T. Mohtar R. H. Hamane M. Yoon P. R. & Yoo S. H. (2023). Development of WEF-P Nexus based on product-supply chain: A case study of phosphorous fertilizer industry in Morocco. Science of The Total Environment 857 159520.,N,N,0,0,0,0,0,0,0,Y,0,1,0,0,0,0,1,1,1,0,N,0,0,0,0,0,0,0,0,0,0,0,0,0,0,0,0,0,0,0,0,0,0,0,0,0,0,0,0,0,0,1,0,0,0,0
2020,Lee S. H. Choi J. Y. Hur S. O. Taniguchi M. Masuhara N. Kim K. S. ... & Yoo S. H. (2020). Food-centric interlinkages in agricultural food-energy-water nexus under climate change and irrigation management. Resources Conservation and Recycling 163 105099.,N,N,0,0,0,0,0,0,0,Y,0,1,0,0,1,0,1,1,1,0,N,0,0,0,0,0,0,0,0,0,0,0,0,0,0,0,0,0,0,0,0,0,0,0,0,0,0,0,0,0,0,0,1,0,0,0
2018,Lee S.-H. Choi J.-Y. Yoo S.-H. & Mohtar R. H. Water footprint for Korean rice products and virtual water trade in a water-energy-food nexus. Water International 43 871–886 (2018).,N,N,0,0,0,0,0,0,0,Y,0,1,0,0,0,1,0,0,1,0,N,0,0,0,0,0,0,0,0,0,0,0,0,0,0,0,0,0,0,0,0,0,0,0,0,0,0,0,0,0,0,0,1,0,0,0
2018,Lee S.-H. Taniguchi M. Mohtar R. Choi J.-Y. & Yoo S.-H. An Analysis of the Water-Energy-Food-Land Requirements and CO2 Emissions for Food Security of Rice in Japan. Sustainability 10 3354 (2018).,N,N,0,0,0,0,0,0,0,N,0,1,0,0,0,1,0,0,1,0,N,0,0,0,0,0,0,0,0,0,0,0,0,0,0,0,0,0,0,0,0,0,0,0,0,0,0,0,0,0,0,0,1,0,0,0
2018,Lehmann S. Implementing the Urban Nexus approach for improved resource-efficiency of developing cities in Southeast-Asia. City Culture and Society 13 46–56 (2018).,Y,Y,1,0,0,1,0,0,1,N,0,0,0,0,0,1,0,0,0,0,Y,1,1,0,0,0,0,0,1,0,0,0,0,0,1,0,0,0,0,0,1,0,0,0,0,0,0,0,1,0,1,0,0,0,0,0
2022,Li H. Li M. Fu Q. Cao K. Liu D. & Li T. (2022). Optimization of biochar systems in the water-food-energy-carbon nexus for sustainable circular agriculture. Journal of Cleaner Production 355 131791.,N,N,0,0,0,0,0,0,0,Y,0,1,0,0,0,0,0,0,1,0,N,0,0,0,0,0,0,0,0,0,0,0,0,0,0,0,0,0,0,0,0,0,0,0,0,0,0,0,0,0,0,1,0,0,0,0
2023,Li H. Li M. Fu Q. Singh V. P. Liu D. & Xu Y. (2023). An optimization approach of water-food-energy nexus in agro-forestry-livestock system under uncertain water supply. Journal of Cleaner Production 137116.,N,N,0,0,0,0,0,0,0,Y,0,1,0,0,1,0,0,0,1,0,N,0,0,0,0,0,0,0,0,0,0,0,0,0,0,0,0,0,0,0,0,0,0,0,0,0,0,0,0,0,0,1,0,0,0,0
2021,Li J. Cui J. Sui P. Yue S. Yang J. Lv Z. ... & Chen Y. (2021). Valuing the synergy in the water-energy-food nexus for cropping systems: A case in the North China Plain. Ecological Indicators 127 107741.,N,N,0,0,0,0,0,0,0,Y,0,0,0,1,0,0,0,0,1,0,N,0,0,0,0,0,0,0,0,0,0,0,0,0,0,0,0,0,0,0,0,0,0,0,0,0,0,0,0,0,0,1,0,0,0,0
2020,Li M. Fu Q. Singh V. P. Liu D. & Li J. (2020). Optimization of sustainable bioenergy production considering energy-food-water-land nexus and livestock manure under uncertainty. Agricultural Systems 184 102900.,N,N,0,0,0,0,0,0,0,Y,0,1,0,0,1,0,0,0,1,0,N,0,0,0,0,0,0,0,0,0,0,0,0,0,0,0,0,0,0,0,0,0,0,0,0,0,0,0,0,0,0,1,0,0,0,0
2023,Li M. Li H. Fu Q. Liu D. Yu L. & Li T. (2021). Approach for optimizing the water-land-food-energy nexus in agroforestry systems under climate change. Agricultural Systems 192 103201.,N,N,0,0,0,0,0,0,0,Y,0,1,0,0,1,0,0,0,1,0,N,0,0,0,0,0,0,0,0,0,0,0,0,0,0,0,0,0,0,0,0,0,0,0,0,0,0,0,0,0,0,1,0,0,0,0
2021,Li M. Singh V. P. Fu Q. Liu D. Li T. & Zhou Y. (2021). Optimization of agricultural water–food–energy nexus in a random environment: an integrated modelling approach. Stochastic Environmental Research and Risk Assessment 35 3-19.,N,N,0,0,0,0,0,0,0,Y,0,1,0,0,0,0,0,0,1,0,N,0,0,0,0,0,0,0,0,0,0,0,0,0,0,0,0,0,0,0,0,0,0,0,0,0,0,0,0,0,0,1,0,0,0,0
2022,Li M. Zhao L. Zhang C. Liu Y. & Fu Q. (2022). Optimization of agricultural resources in water-energy-food nexus in complex environment: A perspective on multienergy coordination. Energy Conversion and Management 258 115537.,N,N,0,0,0,0,0,0,0,Y,0,1,0,0,0,0,0,0,1,0,N,0,0,0,0,0,0,0,0,0,0,0,0,0,0,0,0,0,0,0,0,0,0,0,0,0,0,0,0,0,0,1,0,0,0,0
2021,"Li Mo Haiyan Li Qiang Fu Dong Liu Lei Yu and Tianxiao Li. (2021). ""Approach for optimizing the water-land-food-energy nexus in agroforestry systems under climate change."" Agricultural Systems 192 103201.",N,N,0,0,0,0,0,0,0,Y,0,1,0,0,1,0,0,0,1,0,N,0,0,0,0,0,0,0,0,0,0,0,0,0,0,0,0,0,0,0,0,0,0,0,0,0,0,0,0,0,0,1,0,0,0,0
2020,"Li P. C. & Ma H. W. (2020). Evaluating the environmental impacts of the water-energy-food nexus with a life-cycle approach. Resources Conservation and Recycling, 157 104789.",N,N,0,0,0,0,0,0,0,N,0,1,0,0,0,0,0,0,0,0,N,0,0,0,0,0,0,0,0,0,0,0,0,0,0,0,0,0,0,0,0,0,0,0,0,0,0,0,0,0,0,0,1,0,0,0
2021,Li S. Cai X. Emaminejad S. A. Juneja A. Niroula S. Oh S. ... & Singh V. (2021). Developing an integrated technology-environment-economics model to simulate food-energy-water systems in Corn Belt watersheds. Environmental Modelling & Software 143 105083.,N,N,0,0,0,0,0,0,0,N,0,1,0,0,1,0,0,1,1,0,N,0,0,0,0,0,0,0,0,0,0,0,0,0,0,0,0,0,0,0,0,0,0,0,0,0,0,0,0,0,0,1,0,0,0,0
