,,,,,,,,,,,,,,,,,,,,,,,,,,,,,,,,,Stakeholder engagement scales,,,,,,,,,,,,,,,,,,,,,,,,
2018,Li S. Ziara R. M. M. Dvorak B. & Subbiah J. Assessment of water and energy use at process level in the U.S. beef packing industry: Case study in a typical U.S. large‐size plant. J Food Process Eng 41 (2018).,N,N,0,0,0,0,0,0,0,N,0,1,0,0,0,0,0,0,1,0,N,0,0,0,0,0,0,0,0,0,0,0,0,0,0,0,0,0,0,0,0,0,0,0,0,0,0,0,0,0,1,0,0,0,0,0
2023,Li W. Jiang S. Zhao Y. Li H. Zhu Y. He G. ... & Shang Y. (2023). A copula-based security risk evaluation and probability calculation for water-energy-food nexus. Science of The Total Environment 856 159236.,N,N,0,0,0,0,0,0,0,Y,0,0,0,1,0,0,0,0,0,0,N,0,0,0,0,0,0,0,0,0,0,0,0,0,0,0,0,0,0,0,0,0,0,0,0,0,0,0,0,0,0,1,0,0,0,0
2022,Li X. Zhang L. Hao Y. Zhang P. Xiong X. & Shi Z. (2022). System dynamics modeling of food-energy-water resource security in a megacity of China: Insights from the case of Beijing. Journal of Cleaner Production 355 131773.,N,N,0,0,0,0,0,0,0,Y,0,1,0,0,0,0,0,0,0,0,N,0,0,0,0,0,0,0,0,0,0,0,0,0,0,0,0,0,0,0,0,0,0,0,0,0,0,0,0,0,1,0,0,0,0,0
2021,Li X. Zhang L. Zhang P. Hao Y. & Xiong X. (2021). Urban food-energy-water nexus: a case study in Beijing. Chinese Journal of Population Resources and Environment 19(3) 274-282.,N,N,0,0,0,0,0,0,0,Y,0,1,0,0,0,0,0,0,1,0,N,0,0,0,0,0,0,0,0,0,0,0,0,0,0,0,0,0,0,0,0,0,0,0,0,0,0,0,0,0,1,0,0,0,0,0
2021,Lin H. Borrion A. da Fonseca-Zang W. A. Zang J. W. Leandro W. M. & Campos L. C. (2021). Life cycle assessment of a biogas system for cassava processing in Brazil to close the loop in the water-waste-energy-food nexus. Journal of Cleaner Production 299 126861.,N,N,0,0,0,0,0,0,0,Y,0,1,0,0,0,0,0,0,1,0,N,0,0,0,0,0,0,0,0,0,0,0,0,0,0,0,0,0,0,0,0,0,0,0,0,0,0,0,0,0,0,0,1,0,0,0
2022,Liu S. & Zhao L. (2022). Development and synergetic evolution of the water–energy–food nexus system in the Yellow River Basin. Environmental Science and Pollution Research 29(43) 65549-65564.,N,N,0,0,0,0,0,0,0,Y,0,0,0,0,1,0,0,0,0,0,N,0,0,0,0,0,0,0,0,0,0,0,0,0,0,0,0,0,0,0,0,0,0,0,0,0,0,0,0,0,0,1,0,0,0,0
2022,Liu Y. Jiang Y. Xu C. Lyu J. & Su Z. (2022). A quantitative analysis framework for water-food-energy nexus in an agricultural watershed using WEAP-MODFLOW. Sustainable Production and Consumption 31 693-706.,N,N,0,0,0,0,0,0,0,Y,0,1,0,0,0,0,0,0,0,0,N,0,0,0,0,0,0,0,0,0,0,0,0,0,0,0,0,0,0,0,0,0,0,0,0,0,0,0,0,0,0,0,0,0,0,1
2021,"Liu Z. Huang Q. He C. Wang C. Wang Y. & Li K. (2021). Water-energy nexus within urban agglomeration: An assessment framework combining the multiregional input-output model virtual water and embodied energy. Resources Conservation and Recycling, 164 105113.",N,N,0,0,0,0,0,0,0,Y,0,0,0,1,1,0,0,1,0,0,N,0,0,0,0,0,0,0,0,0,0,0,0,0,0,0,0,0,0,0,0,0,0,0,0,0,0,0,0,0,1,0,0,0,0,0
2021,Livingstone D. Smyth B. M. Foley A. M. Murray S. T. Lyons G. & Johnston C. (2021). Willow coppice in intensive agricultural applications to reduce strain on the food-energy-water nexus. Biomass and Bioenergy 144 105903.,N,N,0,0,0,0,0,0,0,Y,0,1,0,0,1,0,0,0,1,0,N,0,0,0,0,0,0,0,0,0,0,0,0,0,0,0,0,0,0,0,0,0,0,0,0,0,0,0,0,0,1,0,0,0,0,0
2021,Lu J. Lin Y. Wu J. & Zhang C. (2021). Continental-scale spatial distribution sources and health risks of heavy metals in seafood: challenge for the water-food-energy nexus sustainability in coastal regions?. Environmental Science and Pollution Research 1-14.,N,N,0,0,0,0,0,0,0,Y,0,0,0,0,1,0,0,0,0,0,N,0,0,0,0,0,0,0,0,0,0,0,0,0,0,0,0,0,0,0,0,0,0,0,0,0,0,0,0,0,0,1,0,0,0,0
2021,Lu S. Zhang X. Peng H. Skitmore M. Bai X. & Zheng Z. (2021). The energy-food-water nexus: Water footprint of Henan-Hubei-Hunan in China. Renewable and Sustainable Energy Reviews 135 110417.,N,N,0,0,0,0,0,0,0,Y,0,0,0,0,1,1,1,1,0,0,N,0,0,0,0,0,0,0,0,0,0,0,0,0,0,0,0,0,0,0,0,0,0,0,0,0,0,0,0,0,0,1,0,0,0,0
2020,Luqman M. & Al-Ansari T. (2020). Thermodynamic analysis of an Energy-Water-Food (Ewf) nexus driven polygeneration system applied to coastal communities. Energy Conversion and Management 205 112432.,N,N,0,0,0,0,0,0,0,Y,0,1,0,0,0,0,0,0,0,0,N,0,0,0,0,0,0,0,0,0,0,0,0,0,0,0,0,0,0,0,0,0,0,0,0,0,0,0,0,0,0,0,0,0,0,1
2023,Lyu H. Tian F. Zhang K. & Nan Y. (2023). Water-energy-food nexus in the Yarlung Tsangpo-Brahmaputra River Basin: Impact of mainstream hydropower development. Journal of Hydrology: Regional Studies 45 101293.,N,N,0,0,0,0,0,0,0,Y,0,1,0,0,0,0,0,0,0,0,N,0,0,0,0,0,0,0,0,0,0,0,0,0,0,0,0,0,0,0,0,0,0,0,0,0,0,0,0,0,0,0,0,1,0,0
2021,Ma L. Li C. Hu X. Wang P. & Li X. (2021). Synergetic change of water energy and food in China: Quantitative description and challenges. Stochastic Environmental Research and Risk Assessment 35(1) 43-68.,N,N,0,0,0,0,0,0,0,Y,0,1,0,1,1,0,0,1,0,0,N,0,0,0,0,0,0,0,0,0,0,0,0,0,0,0,0,0,0,0,0,0,0,0,0,0,0,0,0,0,0,1,0,0,0,0
2021,Ma Y. Li Y. P. Zhang Y. F. & Huang G. H. (2021). Mathematical modeling for planning water-food-ecology-energy nexus system under uncertainty: A case study of the Aral Sea Basin. Journal of Cleaner Production 308 127368.,N,N,0,0,0,0,0,0,0,Y,0,0,0,0,1,1,0,0,0,0,N,0,0,0,0,0,0,0,0,0,0,0,0,0,0,0,0,0,0,0,0,0,0,0,0,0,0,0,0,0,0,0,0,1,0,0
2020,Mahjabin T. Mejia A. Blumsack S. & Grady C. Integrating embedded resources and network analysis to understand food-energy-water nexus in the US. Science of The Total Environment 709 136153 (2020).,N,N,0,0,0,0,0,0,0,N,0,1,0,0,0,1,0,0,0,0,N,0,0,0,0,0,0,0,0,0,0,0,0,0,0,0,0,0,0,0,0,0,0,0,0,0,0,0,0,0,0,1,0,0,0,0
2021,Mahmood F. Bicer Y. & Al-Ansari T. (2021). Design and thermodynamic assessment of a solar powered energy–food–water nexus driven multigeneration system. Energy Reports 7 3033-3049.,N,N,0,0,0,0,0,0,0,Y,0,1,0,0,0,0,0,0,0,0,N,0,0,0,0,0,0,0,0,0,0,0,0,0,0,0,0,0,0,0,0,0,0,0,0,0,0,0,0,0,0,0,0,0,0,1
2023,Mai Q. Yu D. & Li X. (2023). Coupling characteristics of China's food-energy-water nexus and its implications for regional livelihood well-being. Journal of Cleaner Production 395 136385.,N,N,0,0,0,0,0,0,0,Y,0,0,0,0,1,0,0,0,0,0,N,0,0,0,0,0,0,0,0,0,0,0,0,0,0,0,0,0,0,0,0,0,0,0,0,0,0,0,0,0,0,1,0,0,0,0
2021,Maia R. G. T. & Junior A. O. P. (2021). Eco-Efficiency of the food and beverage industry from the perspective of sensitive indicators of the water-energy-food nexus. Journal of Cleaner Production 324 129283.,N,N,0,0,0,0,0,0,0,Y,0,0,0,0,0,1,0,0,0,0,N,0,0,0,0,0,0,0,0,0,0,0,0,0,0,0,0,0,0,0,0,0,0,0,0,0,0,0,0,0,0,0,1,0,0,0
2019,Malin S. A. & MacIlroy K. Like Oil and Water in the American West: Water Market Access amid Unconventional Oil Production in Colorado. Rural Sociology 84 431–458 (2019).,N,N,0,0,0,0,0,0,0,Y,0,0,0,0,0,0,1,0,0,0,Y,1,1,0,0,1,0,0,0,0,0,0,1,0,0,0,0,1,0,0,0,0,1,0,0,0,0,0,0,0,0,1,0,0,0,0
2021,Maraseni T. An-Vo D. A. Mushtaq S. & Reardon-Smith K. (2021). Carbon smart agriculture: An integrated regional approach offers significant potential to increase profit and resource use efficiency and reduce emissions. Journal of Cleaner Production 282 124555.,N,N,0,0,0,0,0,0,0,Y,0,0,0,0,1,0,0,0,1,0,N,0,0,0,0,0,0,0,0,0,0,0,0,0,0,0,0,0,0,0,0,0,0,0,0,0,0,0,0,0,0,1,0,0,0,0
2017,Martinez-Hernandez E. Leach M. & Yang A. Understanding water-energy-food and ecosystem interactions using the nexus simulation tool NexSym. Applied Energy 206 1009–1021 (2017).,N,N,0,0,0,0,0,0,0,Y,0,1,0,0,1,1,0,0,0,0,N,0,0,0,0,0,0,0,0,0,0,0,0,0,0,0,0,0,0,0,0,0,0,0,0,0,0,0,0,0,1,0,0,0,0,0
2018,Martinez P. Blanco M. & Castro-Campos B. The Water–Energy–Food Nexus: A Fuzzy-Cognitive Mapping Approach to Support Nexus-Compliant Policies in Andalusia (Spain). Water 10 664 (2018).,N,N,0,0,0,0,0,0,0,Y,0,0,0,0,0,0,0,1,0,0,Y,0,1,0,1,0,0,0,0,1,0,0,0,1,0,0,0,1,0,0,0,0,0,0,0,0,1,0,0,0,0,1,0,0,0,0
2019,McGrane S. J. et al. Scaling the nexus: Towards integrated frameworks for analysing water energy and food. Geogr J 185 419–431 (2019).,N,N,0,0,0,0,0,0,0,N,0,1,1,1,0,1,1,1,1,0,Y,1,1,0,0,1,0,0,0,0,0,0,0,1,0,0,0,1,0,0,0,0,0,0,0,0,1,0,0,0,0,1,0,0,0,0
2021,McKuin B. Zumkehr A. Ta J. Bales R. Viers J. H. Pathak T. & Campbell J. E. (2021). Energy and water co-benefits from covering canals with solar panels. Nature Sustainability 4(7) 609-617.,N,N,0,0,0,0,0,0,0,N,0,0,0,0,0,1,0,0,0,0,Y,0,0,0,0,1,0,0,0,0,0,0,0,0,0,0,0,0,0,0,0,0,0,0,0,0,0,0,0,1,0,1,0,0,0,0
2020,Medina-Santana A. A. Flores-Tlacuahuac A. Cárdenas-Barrón L. E. & Fuentes-Cortés L. F. (2020). Optimal design of the water-energy-food nexus for rural communities. Computers & Chemical Engineering 143 107120.,N,N,0,0,0,0,0,0,0,Y,0,1,0,1,0,0,0,0,0,0,N,0,0,0,0,0,0,0,0,0,0,0,0,0,0,0,0,0,0,0,0,0,0,0,0,0,0,0,0,0,1,0,0,0,0,0
2019,Memarzadeh M. Moura S. & Horvath A. Optimizing dynamics of integrated food–energy–water systems under the risk of climate change. Environ. Res. Lett. 14 074010 (2019).,N,N,0,0,0,0,0,0,0,Y,0,1,0,0,0,0,0,0,0,0,N,0,0,0,0,0,0,0,0,0,0,0,0,0,0,0,0,0,0,0,0,0,0,0,0,0,0,0,0,0,0,1,0,0,0,0
2022,Meng F. Wang D. Meng X. Li H. Liu G. Yuan Q. ... & Zhang Y. (2022). Mapping urban energy–water–land nexus within a multiscale economy: A case study of four megacities in China. Energy 239 122038.,N,N,0,0,0,0,0,0,0,Y,0,1,0,1,1,1,0,0,0,0,N,0,0,0,0,0,0,0,0,0,0,0,0,0,0,0,0,0,0,0,0,0,0,0,0,0,0,0,0,0,1,0,0,0,0,0
2023,Meng F. Yuan Q. Bellezoni R. A. Puppim de Oliveira J. A. Hu Y. Jing R. ... & Seto K. C. (2023). The food-water-energy nexus and green roofs in Sao Jose dos Campos Brazil and Johannesburg South Africa. npj Urban Sustainability 3(1) 12.,N,N,0,0,0,0,0,0,0,Y,0,0,0,0,1,1,1,0,0,0,N,0,0,0,0,0,0,0,0,0,0,0,0,0,0,0,0,0,0,0,0,0,0,0,0,0,0,0,0,0,1,0,0,0,0,0
2021,Meng Y. Liu J. Wang  Z. Mao G. Wang K. & Yang H. (2021). Undermined co-benefits of hydropower and irrigation under climate change. Resources Conservation and Recycling 167 105375.,N,N,0,0,0,0,0,0,0,Y,0,1,0,1,1,0,0,0,0,0,N,0,0,0,0,0,0,0,0,0,0,0,0,0,0,0,0,0,0,0,0,0,0,0,0,0,0,0,0,0,0,0,0,1,0,0
2022,Milindi P. S. De Lieto F. & Chopra S. S. (2022). Food waste-Energy-Water-Emissions (FEWE) nexus in the food service sector: Comparing a restaurant meal from imported ingredients versus an imported ready-to-eat meal. Journal of Cleaner Production 380 134871.,N,N,0,0,0,0,0,0,0,Y,0,0,0,0,1,0,0,0,1,0,N,0,0,0,0,0,0,0,0,0,0,0,0,0,0,0,0,0,0,0,0,0,0,0,0,0,0,0,0,0,0,0,0,0,0,1
2022,Mirzaei A. Abdeshahi A. Azarm H. & Naghavi S. (2022). New design of water-energy-food-environment nexus for sustainable agricultural management. Stochastic Environmental Research and Risk Assessment 36(7) 1861-1874.,N,N,0,0,0,0,0,0,0,Y,0,0,0,0,0,0,0,1,0,0,N,0,0,0,0,0,0,0,0,0,0,0,0,0,0,0,0,0,0,0,0,0,0,0,0,0,0,0,0,0,0,1,0,0,0,0
2018,"Mochizuki J. Magnuszewski P. & Linnerooth-Bayer J. Games for Aiding Stakeholder Deliberation on Nexus Policy Issues. in Managing Water Soil and Waste Resources to Achieve Sustainable Development Goals (eds. Hülsmann S. & Ardakania, R.) 93–124 (Springer International Publishing 2018). ",N,N,0,0,0,0,0,0,0,Y,0,0,0,1,0,0,0,0,0,0,Y,0,0,0,0,0,0,0,0,0,0,0,0,0,0,0,0,0,0,0,0,0,0,0,0,0,0,0,0,1,0,0,0,0,0,1
2022,Möck M. Vogeler C. S. Bandelow N. C. & Schröder B. (2022). Layering action situations to integrate spatial scales resource linkages and change over time: the case of groundwater management in agricultural hubs in Germany. Policy Studies Journal 50(1) 111-142.,N,N,0,0,0,0,0,0,0,Y,0,0,0,0,0,0,1,0,0,0,Y,0,0,0,0,0,0,0,0,0,1,1,0,0,0,1,0,0,0,0,0,1,0,0,0,0,0,0,0,0,0,1,0,0,0,0
2019,Mohammadpour P. Mahjabin T. Fernandez J. & Grady C. From national indices to regional action—An Analysis of food energy water security in Ecuador Bolivia and Peru. Environmental Science & Policy 101 291–301 (2019).,N,N,0,0,0,0,0,0,0,Y,0,1,0,0,0,1,0,0,0,0,N,0,0,0,0,0,0,0,0,0,0,0,0,0,0,0,0,0,0,0,0,0,0,0,0,0,0,0,0,0,0,0,1,0,0,0
2016,Mohtar R. H. & Lawford R. Present and future of the water-energy-food nexus and the role of the community of practice. J Environ Stud Sci 6 192–199 (2016).,N,N,0,0,0,0,0,0,0,Y,0,1,0,0,0,0,0,0,0,0,N,0,0,0,0,0,0,0,0,0,0,0,0,0,0,0,0,0,0,0,0,0,0,0,0,0,0,0,0,0,0,0,0,0,0,1
2015,Mohtar Rabi H. Amjad T. Assi and Bassel Daher. “Bridging the Water and Food Gap: The Role of the Water-Energy-Food Nexus.” (2015). ,N,N,0,0,0,0,0,0,0,Y,0,1,0,0,0,0,0,0,0,0,N,0,0,0,0,0,0,0,0,0,0,0,0,0,0,0,0,0,0,0,0,0,0,0,0,0,0,0,0,0,0,0,0,0,0,1
2021,Molajou A. Pouladi P. & Afshar A. (2021). Incorporating social system into water-food-energy nexus. Water Resources Management 35 4561-4580.,N,N,0,0,0,0,0,0,0,Y,0,1,0,0,0,1,0,0,0,0,Y,1,0,0,0,0,0,0,0,0,0,1,0,0,0,1,0,0,0,0,0,1,0,0,0,0,0,0,0,0,0,1,0,0,0,0
2023,Mondal K. Chatterjee C. & Singh R. (2023). An analytical framework for state level water-energy-food nexus analysis in India: Insight from implemented policies. Environmental Science & Policy 141 33-49.,Y,N,1,1,0,0,0,0,0,Y,0,1,0,0,0,0,0,0,0,0,N,0,0,0,0,0,0,0,0,0,0,0,0,0,0,0,0,0,0,0,0,0,0,0,0,0,0,0,0,0,0,1,0,0,0,0
2021,Moraes-Santos E. C. Dias R. A. & Balestieri J. A. P. (2021). Groundwater and the water-food-energy nexus: The grants for water resources use and its importance and necessity of integrated management. Land Use Policy 109 105585.,N,N,0,0,0,0,0,0,0,Y,0,1,0,0,0,0,0,0,0,0,N,0,0,0,0,0,0,0,0,0,0,0,0,0,0,0,0,0,0,0,0,0,0,0,0,0,0,0,0,0,1,0,0,0,0,0
2022,Moreira F. D. A. Dalla Fontana M. Sepe P. M. Lopes M. V. Moura L. D. V. Medeiros L. S. ... & Di Giulio G. M. (2022). Co-creating sustainability indicators for the local water–energy–food nexus. Sustainability Science 17(6) 2315-2329.,Y,N,0,1,0,0,0,0,0,Y,0,1,0,0,0,1,1,0,0,0,Y,0,1,0,0,0,0,0,0,0,0,0,0,0,1,0,0,0,0,0,1,0,0,0,0,0,1,0,0,0,1,0,0,0,0,0
2023,Morlet-Espinosa J. Flores-Tlacuahuac A. & Fuentes-Cortes L. F. (2023). A combined variational encoding and optimization framework for design of the water-energy-food nexus. Computers & Chemical Engineering 108076.,N,N,0,0,0,0,0,0,0,Y,0,1,0,0,0,0,0,0,0,0,N,0,0,0,0,0,0,0,0,0,0,0,0,0,0,0,0,0,0,0,0,0,0,0,0,0,0,0,0,0,0,0,0,0,0,1
2019,Mroue A. M. Mohtar R. H. Pistikopoulos E. N. & Holtzapple M. T. Energy Portfolio Assessment Tool (EPAT): Sustainable energy planning using the WEF nexus approach – Texas case. Science of The Total Environment 648 1649–1664 (2019).,N,N,0,0,0,0,0,0,0,Y,0,1,0,0,1,0,0,0,1,0,N,0,0,0,0,0,0,0,0,0,0,0,0,0,0,0,0,0,0,0,0,0,0,0,0,0,0,0,0,0,0,1,0,0,0,0
2023,Muhirwa F. Shen L. Elshkaki A. Chiaka J. C. Zhong S. Bönecke E. ... & Harerimana B. (2023). Alert in the dynamics of water-energy-food production in African countries from a nexus perspective. Resources Conservation and Recycling 194 106990.,N,N,0,0,0,0,0,0,0,Y,0,0,0,1,1,1,1,0,1,0,N,0,0,0,0,0,0,0,0,0,0,0,0,0,0,0,0,0,0,0,0,0,0,0,0,0,0,0,0,0,0,0,1,0,0,0
2022,Muhirwa F. Shen L. Elshkaki A. Zhong S. Hu S. Hirwa H. ... & Mulinga N. (2022). Ecological balance emerges in implementing the water-energy-food security nexus in well-developed countries in Africa. Science of The Total Environment 833 154999.,N,N,0,0,0,0,0,0,0,Y,0,0,0,0,1,0,1,1,1,0,N,0,0,0,0,0,0,0,0,0,0,0,0,0,0,0,0,0,0,0,0,0,0,0,0,0,0,0,0,0,0,0,1,0,0,0
2022,Mukherji A. (2022). Sustainable groundwater management in India needs a water‐energy‐food nexus approach. Applied Economic Perspectives and Policy 44(1) 394-410.,N,N,0,0,0,0,0,0,0,N,0,0,0,0,0,1,0,0,0,0,N,0,0,0,0,0,0,0,0,0,0,0,0,0,0,0,0,0,0,0,0,0,0,0,0,0,0,0,0,0,0,0,1,0,0,0
2019,Munoz Castillo R. et al. The land-water nexus of biofuel production in Brazil: Analysis of synergies and trade-offs using a multiregional input-output model. Journal of Cleaner Production 214 52–61 (2019).,N,N,0,0,0,0,0,0,0,Y,0,1,0,1,1,1,1,1,0,0,N,0,0,0,0,0,0,0,0,0,0,0,0,0,0,0,0,0,0,0,0,0,0,0,0,0,0,0,0,0,0,1,0,0,0,0
2021,Naderi M. M. Mirchi A. Bavani A. R. M. Goharian E. & Madani K. (2021). System dynamics simulation of regional water supply and demand using a food-energy-water nexus approach: application to Qazvin Plain Iran. Journal of Environmental Management 280 111843.,N,N,0,0,0,0,0,0,0,Y,0,1,0,0,1,1,1,0,0,0,N,0,0,0,0,0,0,0,0,0,0,0,0,0,0,0,0,0,0,0,0,0,0,0,0,0,0,0,0,0,0,1,0,0,0,0
2021,Namany S. Govindan R. Di Martino M. Pistikopoulos E. N. Linke P. Avraamidou S. & Al-Ansari T. (2021). An energy-water-food nexus-based decision-making framework to guide national priorities in Qatar. Sustainable Cities and Society 75 103342.,N,N,0,0,0,0,0,0,0,Y,0,1,0,0,0,0,0,0,0,0,N,0,0,0,0,0,0,0,0,0,0,0,0,0,0,0,0,0,0,0,0,0,0,0,0,0,0,0,0,0,0,0,1,0,0,0
2020,Ngammuangtueng P. Jakrawatana N. & Gheewala S. H. (2020). Nexus Resources efficiency assessment and management towards transition to sustainable bioeconomy in Thailand. Resources Conservation and Recycling 160 104945.,N,N,0,0,0,0,0,0,0,Y,0,1,0,1,1,0,0,0,0,0,N,0,0,0,0,0,0,0,0,0,0,0,0,0,0,0,0,0,0,0,0,0,0,0,0,0,0,0,0,0,0,0,1,0,0,0
2023,Ngammuangtueng P. Nilsalab P. Chomwong Y. Wongruang P. Jakrawatana N. Sandhu S. & Gheewala S. H. (2023). Water-energy-food nexus of local bioeconomy hub and future climate change impact implication. Journal of Cleaner Production 136543.,N,N,0,0,0,0,0,0,0,Y,0,1,0,0,1,1,1,0,0,0,Y,1,1,0,0,1,0,0,0,0,0,0,1,0,0,0,0,1,0,0,0,0,0,0,0,0,1,0,0,0,0,1,0,0,0,0
2021,Ngarava S. (2021). Long term relationship between food energy and water inflation in South Africa. Water-Energy Nexus 4 123-133.,N,N,0,0,0,0,0,0,0,Y,0,0,0,0,0,1,0,0,0,0,N,0,0,0,0,0,0,0,0,0,0,0,0,0,0,0,0,0,0,0,0,0,0,0,0,0,0,0,0,0,0,0,1,0,0,0
2020,Nhamo L. Mabhaudhi T. Mpandeli S. Dickens C. Nhemachena C. Senzanje A. ... & Modi A. T. (2020). An integrative analytical model for the water-energy-food nexus: South Africa case study. Environmental Science & Policy 109 15-24.,N,N,0,0,0,0,0,0,0,Y,0,1,0,0,1,1,0,0,1,0,N,0,0,0,0,0,0,0,0,0,0,0,0,0,0,0,0,0,0,0,0,0,0,0,0,0,0,0,0,0,0,0,1,0,0,0
2019,Nie Y. et al. A Food-Energy-Water Nexus approach for land use optimization. Science of The Total Environment 659 7–19 (2019).,N,N,0,0,0,0,0,0,0,Y,0,1,0,0,1,0,0,0,0,0,N,0,0,0,0,0,0,0,0,0,0,0,0,0,0,0,0,0,0,0,0,0,0,0,0,0,0,0,0,0,1,0,0,0,0,0
2018,Nie Y. Avraamidou S. Li J. Xiao X. & Pistikopoulos E. N. Land use modeling and optimization based on food-energy-water nexus: a case study on crop-livestock systems. in Computer Aided Chemical Engineering vol. 44 1939–1944 (Elsevier 2018).,N,N,0,0,0,0,0,0,0,N,0,1,0,0,1,0,0,0,0,0,N,0,0,0,0,0,0,0,0,0,0,0,0,0,0,0,0,0,0,0,0,0,0,0,0,0,0,0,0,0,1,0,0,0,0,0
2022,Nika C. E. Vasilaki V. Renfrew D. Danishvar M. Echchelh A. & Katsou E. (2022). Assessing circularity of multi-sectoral systems under the Water-Energy-Food-Ecosystems (WEFE) nexus. Water Research 221 118842.,N,N,0,0,0,0,0,0,0,Y,0,1,0,0,0,0,0,0,0,0,N,0,0,0,0,0,0,0,0,0,0,0,0,0,0,0,0,0,0,0,0,0,0,0,0,0,0,0,0,0,0,1,0,0,0,0
2022,Nisal A. Diwekar U. Hanumante N. Shastri Y. & Cabezas H. (2022). Integrated model for food-energy-water (FEW) nexus to study global sustainability: The main generalized global sustainability model (GGSM). PloS one 17(5) e0267403.,N,N,0,0,0,0,0,0,0,Y,0,1,0,1,1,0,0,0,0,0,N,0,0,0,0,0,0,0,0,0,0,0,0,0,0,0,0,0,0,0,0,0,0,0,0,0,0,0,0,0,0,0,0,0,1,0
2020,Niva V. Cai J. Taka M. Kummu M. & Varis O. (2020). China’s sustainable water-energy-food nexus by 2030: Impacts of urbanization on sectoral water demand. Journal of Cleaner Production 251 119755.,N,N,0,0,0,0,0,0,0,Y,0,0,0,0,0,1,0,0,0,0,N,0,0,0,0,0,0,0,0,0,0,0,0,0,0,0,0,0,0,0,0,0,0,0,0,0,0,0,0,0,0,1,0,0,0,0
2023,Nkiaka E. Bryant R. G. Manda S. & Okumah M. (2023). A quantitative understanding of the state and determinants of water-energy-food security in Africa. Environmental Science & Policy 140 250-260.,N,N,0,0,0,0,0,0,0,Y,0,0,0,0,0,1,1,0,0,0,N,0,0,0,0,0,0,0,0,0,0,0,0,0,0,0,0,0,0,0,0,0,0,0,0,0,0,0,0,0,0,0,0,1,0,0
2021,Nkiaka E. Okpara U. T. & Okumah M. (2021). Food-energy-water security in sub-Saharan Africa: Quantitative and spatial assessments using an indicator-based approach. Environmental Development 40 100655.,N,N,0,0,0,0,0,0,0,Y,0,0,0,0,0,1,1,0,0,0,N,0,0,0,0,0,0,0,0,0,0,0,0,0,0,0,0,0,0,0,0,0,0,0,0,0,0,0,0,0,0,0,0,1,0,0
2022,Norouzi N. (2022). Presenting a conceptual model of water-energy-food nexus in Iran. Current Research in Environmental Sustainability 4 100119.,N,N,0,0,0,0,0,0,0,Y,0,1,0,0,0,0,0,0,0,0,N,0,0,0,0,0,0,0,0,0,0,0,0,0,0,0,0,0,0,0,0,0,0,0,0,0,0,0,0,0,0,0,1,0,0,0
2020,Norouzi N. & Kalantari G. (2020). The food-water-energy nexus governance model: a case study for Iran. Water-Energy Nexus 3 72-80.,N,N,0,0,0,0,0,0,0,Y,0,1,0,0,0,0,1,0,0,0,N,0,0,0,0,0,0,0,0,0,0,0,0,0,0,0,0,0,0,0,0,0,0,0,0,0,0,0,0,0,0,0,1,0,0,0
2021,Núñez-López J. M. Rubio-Castro E. & Ponce-Ortega J. M. (2021). Involving resilience in optimizing the water-energy-food nexus at macroscopic level. Process Safety and Environmental Protection 147 259-273.,N,N,0,0,0,0,0,0,0,Y,0,1,0,0,1,0,0,0,0,0,N,0,0,0,0,0,0,0,0,0,0,0,0,0,0,0,0,0,0,0,0,0,0,0,0,0,0,0,0,0,0,1,0,0,0,0
2022,Núñez-López J. M. Rubio-Castro E. & Ponce-Ortega J. M. (2022). Optimizing resilience at water-energy-food nexus. Computers & Chemical Engineering 160 107710.,N,N,0,0,0,0,0,0,0,Y,0,1,0,0,1,0,0,0,0,0,N,0,0,0,0,0,0,0,0,0,0,0,0,0,0,0,0,0,0,0,0,0,0,0,0,0,0,0,0,0,0,1,0,0,0,0
2018,OECD (2018) Managing the Water-Energy-Land-Food Nexus in Korea: Policies and Governance Options | READ online. oecd-ilibrary.org https://read.oecd-ilibrary.org/environment/managing-the-water-energy-land-food-nexus-in-korea_9789264306523-en.,N,N,0,0,0,0,0,0,0,Y,0,0,0,0,0,0,0,0,0,0,Y,0,0,0,0,0,0,0,0,0,0,0,0,0,0,0,0,0,0,0,0,0,0,0,0,0,0,0,0,1,0,0,1,0,0,0
2021,Ogbolumani O. A. & Nwulu N. I. (2021). Multi-objective optimisation of constrained food-energy-water-nexus systems for sustainable resource allocation. Sustainable Energy Technologies and Assessments 44 100967.,N,N,0,0,0,0,0,0,0,Y,0,1,0,0,0,0,0,0,0,0,N,0,0,0,0,0,0,0,0,0,0,0,0,0,0,0,0,0,0,0,0,0,0,0,0,0,0,0,0,0,0,0,1,0,0,0
2022,Ogbolumani O. A. & Nwulu N. I. (2022). A food-energy-water nexus meta-model for food and energy security. Sustainable Production and Consumption 30 438-453.,N,N,0,0,0,0,0,0,0,Y,0,0,0,1,0,0,0,0,0,0,N,0,0,0,0,0,0,0,0,0,0,0,0,0,0,0,0,0,0,0,0,0,0,0,0,0,0,0,0,0,0,1,0,0,0,0
2023,Okola I. Omulo E. O. Ochieng D. O. & Ouma G. (2023). A comparison of evolutionary algorithms on a Large Scale Many-Objective Problem in Food–Energy–Water Nexus. Results in Control and Optimization 10 100195.,N,N,0,0,0,0,0,0,0,Y,0,0,0,1,0,1,0,0,0,0,N,0,0,0,0,0,0,0,0,0,0,0,0,0,0,0,0,0,0,0,0,0,0,0,0,0,0,0,0,0,0,0,0,0,0,1
2021,Okonkwo E. C. Abdullatif Y. M. & Tareq A. A. (2021). A nanomaterial integrated technology approach to enhance the energy-water-food nexus. Renewable and Sustainable Energy Reviews 145 111118.,N,N,0,0,0,0,0,0,0,N,0,1,0,0,0,0,0,0,0,0,N,0,0,0,0,0,0,0,0,0,0,0,0,0,0,0,0,0,0,0,0,0,0,0,0,0,0,0,0,0,0,0,1,0,0,0
2022,"Opoku E. K. Adjei K. A. Gyamfi C. Vuu C. Appiah-Adjei E. K. Odai S. N. & Siabi E. K. (2022). Quantifying and analysing water trade-offs in the water-energy-food nexus: The case of Ghana. Water-Energy Nexus, 5 8-20.",N,N,0,0,0,0,0,0,0,Y,0,1,0,1,1,0,0,0,0,0,N,0,0,0,0,0,0,0,0,0,0,0,0,0,0,0,0,0,0,0,0,0,0,0,0,0,0,0,0,0,0,0,1,0,0,0
2021,Ouyang Y. Cai Y. Xie Y. Yue W. & Guo H. (2021). Multi-scale simulation and dynamic coordination evaluation of water-energy-food and economy for the Pearl River Delta city cluster in China. Ecological Indicators 130 108155.,N,N,0,0,0,0,0,0,0,Y,0,1,0,0,0,0,0,0,0,0,N,0,0,0,0,0,0,0,0,0,0,0,0,0,0,0,0,0,0,0,0,0,0,0,0,0,0,0,0,0,0,1,0,0,0,0
2023,Oviroh P. O. Austin-Breneman J. Chien C. C. Chakravarthula P. N. Harikumar V. Shiva P. ... & Papalambros P. Y. (2023). Micro Water-Energy-Food (MicroWEF) Nexus: A system design optimization framework for Integrated Natural Resource Conservation and Development (INRCD) projects at community scale. Applied Energy 333 120583.,N,N,0,0,0,0,0,0,0,Y,0,1,0,0,0,0,0,0,0,0,N,0,0,0,0,0,0,0,0,0,0,0,0,0,0,0,0,0,0,0,0,0,0,0,0,0,0,0,0,0,1,0,0,0,0,0
2019,Paim M.-A. et al. Mainstreaming the Water-Energy-Food Nexus through nationally determined contributions (NDCs): the case of Brazil. Climate Policy 20 163–178 (2020).,N,N,0,0,0,0,0,0,0,N,0,0,0,0,0,1,1,1,0,0,N,0,0,0,0,0,0,0,0,0,0,0,0,0,0,0,0,0,0,0,0,0,0,0,0,0,0,0,0,0,0,0,1,0,0,0
2022,Pan Y. & Chen Y. (2022). Spatio-Temporal Evolution Measurement and Obstacle Factors of the Vulnerability of Water-Energy-Food-Ecology Nexus in the Yangtze River Economic Belt. Polish Journal of Environmental Studies 31(5).,N,N,0,0,0,0,0,0,0,Y,0,0,0,0,1,0,0,1,0,0,N,0,0,0,0,0,0,0,0,0,0,0,0,0,0,0,0,0,0,0,0,0,0,0,0,0,0,0,0,0,0,1,0,0,0,0
2022,Papadopoulou M. P. & Vlachou A. (2022). Conceptualization of NEXUS elements in the marine environment (Marine NEXUS). Euro-Mediterranean Journal for Environmental Integration 7(3) 399-406.,N,N,0,0,0,0,0,0,0,Y,0,0,0,1,0,0,0,0,0,0,N,0,0,0,0,0,0,0,0,0,0,0,0,0,0,0,0,0,0,0,0,0,0,0,0,0,0,0,0,0,0,1,0,0,0,0
2022,"Parihar C. M. Meena B. R. Nayak H. S. Patra K. Sena D. R. Singh, R. ... & Abdallah A. M. (2022). Co-implementation of precision nutrient management in long-term conservation agriculture-based systems: A step towards sustainable energy-water-food nexus. Energy 254 124243.",N,N,0,0,0,0,0,0,0,Y,0,0,0,0,1,0,0,0,1,0,N,0,0,0,0,0,0,0,0,0,0,0,0,0,0,0,0,0,0,0,0,0,0,0,0,0,0,0,0,0,1,0,0,0,0,0
2019,Payet-Burin R. Kromann M. Pereira-Cardenal S. Strzepek K. M. & Bauer-Gottwein P. WHAT-IF: an open-source decision support tool for water infrastructure investment planning within the water–energy–food–climate nexus. Hydrol. Earth Syst. Sci. 23 4129–4152 (2019).,N,N,0,0,0,0,0,0,0,N,0,1,0,0,0,1,0,0,0,0,N,0,0,0,0,0,0,0,0,0,0,0,0,0,0,0,0,0,0,0,0,0,0,0,0,0,0,0,0,0,0,0,0,1,0,0
2022,Peng W. Zheng H. Robinson B. E. Li C. & Li R. (2022). Comparing the importance of farming resource endowments and agricultural livelihood diversification for agricultural sustainability from the perspective of the food–energy–water nexus. Journal of Cleaner Production 380 135193.,N,N,0,0,0,0,0,0,0,Y,0,0,0,0,1,0,1,1,0,0,Y,1,0,0,0,0,0,0,0,0,0,1,0,0,0,1,0,0,0,0,0,1,0,0,0,0,0,0,0,0,1,0,0,0,0,0
